[
  {
    "id": "b1-noun-tag",
    "wordType": "noun",
    "headword": "Tag",
    "translations": {
      "en": [
        "day"
      ],
      "fa": [
        "روز"
      ]
    },
    "nounForms": {
      "article": "der",
      "plural": "-e"
    },
    "sentences": [
      {
        "german": "Wir sehen uns jeden Tag.",
        "translations": {
          "en": "We see each other every day.",
          "fa": "ما هر روز همدیگر را می‌بینیم."
        }
      }
    ],
    "level": "B1",
    "tags": [
      "time",
      "daily-routine"
    ]
  },
  {
    "id": "b1-noun-morgen",
    "wordType": "noun",
    "headword": "Morgen",
    "translations": {
      "en": [
        "morning"
      ],
      "fa": [
        "صبح"
      ]
    },
    "nounForms": {
      "article": "der",
      "plural": "-"
    },
    "sentences": [
      {
        "german": "Am Morgen trinke ich immer Kaffee.",
        "translations": {
          "en": "In the morning I always drink coffee.",
          "fa": "صبح‌ها همیشه قهوه می‌نوشم."
        }
      }
    ],
    "level": "B1",
    "tags": [
      "time",
      "daily-routine"
    ]
  },
  {
    "id": "b1-noun-vormittag",
    "wordType": "noun",
    "headword": "Vormittag",
    "translations": {
      "en": [
        "late morning",
        "forenoon"
      ],
      "fa": [
        "پیش از ظهر"
      ]
    },
    "nounForms": {
      "article": "der",
      "plural": "-e"
    },
    "sentences": [
      {
        "german": "Ich habe am Vormittag einen Termin.",
        "translations": {
          "en": "I have an appointment in the late morning.",
          "fa": "پیش از ظهر یک قرار ملاقات دارم."
        }
      }
    ],
    "level": "B1",
    "tags": [
      "time"
    ]
  },
  {
    "id": "b1-noun-mittag",
    "wordType": "noun",
    "headword": "Mittag",
    "translations": {
      "en": [
        "midday",
        "noon"
      ],
      "fa": [
        "ظهر"
      ]
    },
    "nounForms": {
      "article": "der",
      "plural": "-e"
    },
    "sentences": [
      {
        "german": "Wir treffen uns zu Mittag.",
        "translations": {
          "en": "We're meeting at noon.",
          "fa": "ظهر همدیگر را می‌بینیم."
        }
      }
    ],
    "level": "B1",
    "tags": [
      "time"
    ]
  },
  {
    "id": "b1-noun-nachmittag",
    "wordType": "noun",
    "headword": "Nachmittag",
    "translations": {
      "en": [
        "afternoon"
      ],
      "fa": [
        "بعدازظهر"
      ]
    },
    "nounForms": {
      "article": "der",
      "plural": "-e"
    },
    "sentences": [
      {
        "german": "Am Nachmittag gehe ich einkaufen.",
        "translations": {
          "en": "In the afternoon I'm going shopping.",
          "fa": "بعدازظهر به خرید می‌روم."
        }
      }
    ],
    "level": "B1",
    "tags": [
      "time"
    ]
  },
  {
    "id": "b1-noun-abend",
    "wordType": "noun",
    "headword": "Abend",
    "translations": {
      "en": [
        "evening"
      ],
      "fa": [
        "عصر",
        "غروب"
      ]
    },
    "nounForms": {
      "article": "der",
      "plural": "-e"
    },
    "sentences": [
      {
        "german": "Am Abend gehen wir ins Kino.",
        "translations": {
          "en": "In the evening we're going to the cinema.",
          "fa": "عصر به سینما می‌رویم."
        }
      }
    ],
    "level": "B1",
    "tags": [
      "time",
      "daily-routine"
    ]
  },
  {
    "id": "b1-noun-nacht",
    "wordType": "noun",
    "headword": "Nacht",
    "translations": {
      "en": [
        "night"
      ],
      "fa": [
        "شب"
      ]
    },
    "nounForms": {
      "article": "die",
      "plural": "¨-e"
    },
    "sentences": [
      {
        "german": "In der Nacht ist es sehr ruhig.",
        "translations": {
          "en": "At night it's very quiet.",
          "fa": "شب‌ها خیلی آرام است."
        }
      }
    ],
    "level": "B1",
    "tags": [
      "time"
    ]
  },
  {
    "id": "b1-noun-woche",
    "wordType": "noun",
    "headword": "Woche",
    "translations": {
      "en": [
        "week"
      ],
      "fa": [
        "هفته"
      ]
    },
    "nounForms": {
      "article": "die",
      "plural": "-n"
    },
    "sentences": [
      {
        "german": "Nächste Woche fahre ich nach Berlin.",
        "translations": {
          "en": "Next week I'm going to Berlin.",
          "fa": "هفتهٔ آینده به برلین می‌روم."
        }
      }
    ],
    "level": "B1",
    "tags": [
      "time"
    ]
  },
  {
    "id": "b1-noun-monat",
    "wordType": "noun",
    "headword": "Monat",
    "translations": {
      "en": [
        "month"
      ],
      "fa": [
        "ماه"
      ]
    },
    "nounForms": {
      "article": "der",
      "plural": "-e"
    },
    "sentences": [
      {
        "german": "Der Kurs dauert drei Monate.",
        "translations": {
          "en": "The course lasts three months.",
          "fa": "این دوره سه ماه طول می‌کشد."
        }
      }
    ],
    "level": "B1",
    "tags": [
      "time"
    ]
  },
  {
    "id": "b1-noun-jahr",
    "wordType": "noun",
    "headword": "Jahr",
    "translations": {
      "en": [
        "year"
      ],
      "fa": [
        "سال"
      ]
    },
    "nounForms": {
      "article": "das",
      "plural": "-e"
    },
    "sentences": [
      {
        "german": "Ich wohne seit einem Jahr in Dushanbe.",
        "translations": {
          "en": "I've been living in Dushanbe for a year.",
          "fa": "یک سال است که در دوشنبه زندگی می‌کنم."
        }
      }
    ],
    "level": "B1",
    "tags": [
      "time"
    ]
  },
  {
    "id": "b1-noun-wochenende",
    "wordType": "noun",
    "headword": "Wochenende",
    "translations": {
      "en": [
        "weekend"
      ],
      "fa": [
        "آخر هفته"
      ]
    },
    "nounForms": {
      "article": "das",
      "plural": "-n"
    },
    "sentences": [
      {
        "german": "Was machst du am Wochenende?",
        "translations": {
          "en": "What are you doing on the weekend?",
          "fa": "آخر هفته چه‌کار می‌کنی؟"
        }
      }
    ],
    "level": "B1",
    "tags": [
      "time"
    ]
  },
  {
    "id": "b1-noun-anfang",
    "wordType": "noun",
    "headword": "Anfang",
    "translations": {
      "en": [
        "beginning",
        "start"
      ],
      "fa": [
        "شروع",
        "آغاز"
      ]
    },
    "nounForms": {
      "article": "der",
      "plural": "¨-e"
    },
    "sentences": [
      {
        "german": "Am Anfang habe ich bei der Arbeit viele Fragen gestellt.",
        "translations": {
          "en": "At the beginning I asked a lot of questions at work.",
          "fa": "در ابتدا در محل کار سؤال‌های زیادی پرسیدم."
        }
      },
      {
        "german": "Wir machen Anfang Juli Ferien.",
        "translations": {
          "en": "We're going on holiday at the start of July.",
          "fa": "ما اوایل ژوئیه به تعطیلات می‌رویم."
        }
      }
    ],
    "level": "B1",
    "tags": [
      "time"
    ]
  },
  {
    "id": "b1-verb-anfangen",
    "wordType": "verb",
    "headword": "anfangen",
    "translations": {
      "en": [
        "to begin",
        "to start"
      ],
      "fa": [
        "شروع کردن"
      ]
    },
    "verbForms": {
      "infinitive": "anfangen",
      "presentThirdPerson": "fängt an",
      "simplePast": "fing an",
      "perfect": "hat angefangen",
      "passive": "wird angefangen",
      "auxiliaryIsSein": false,
      "separable": true
    },
    "sentences": [
      {
        "german": "Wann fängst du mit der Arbeit an?",
        "translations": {
          "en": "When are you starting work?",
          "fa": "کِی کارت را شروع می‌کنی؟"
        }
      },
      {
        "german": "Hier fängt die Bahnhofstraße an.",
        "translations": {
          "en": "This is where Bahnhofstraße begins.",
          "fa": "خیابان بان‌هوف‌اشتراسه از اینجا شروع می‌شود."
        }
      }
    ],
    "level": "B1",
    "tags": [
      "daily-routine"
    ]
  },
  {
    "id": "b1-adverb-anfangs",
    "wordType": "adverb",
    "headword": "anfangs",
    "translations": {
      "en": [
        "at first",
        "initially"
      ],
      "fa": [
        "در ابتدا",
        "ابتدا"
      ]
    },
    "sentences": [
      {
        "german": "Anfangs ging alles gut.",
        "translations": {
          "en": "At first everything went well.",
          "fa": "در ابتدا همه‌چیز خوب پیش می‌رفت."
        }
      }
    ],
    "level": "B1",
    "tags": [
      "time"
    ]
  },
  {
    "id": "b1-verb-abbiegen",
    "wordType": "verb",
    "headword": "abbiegen",
    "translations": {
      "en": [
        "to turn (off)"
      ],
      "fa": [
        "پیچیدن"
      ]
    },
    "verbForms": {
      "infinitive": "abbiegen",
      "presentThirdPerson": "biegt ab",
      "simplePast": "bog ab",
      "perfect": "ist abgebogen",
      "passive": null,
      "auxiliaryIsSein": true,
      "separable": true
    },
    "sentences": [
      {
        "german": "An der nächsten Kreuzung müssen Sie links abbiegen.",
        "translations": {
          "en": "You have to turn left at the next intersection.",
          "fa": "در چهارراه بعدی باید به چپ بپیچید."
        }
      }
    ],
    "level": "B1",
    "tags": [
      "directions",
      "traffic"
    ]
  },
  {
    "id": "b1-noun-abbildung",
    "wordType": "noun",
    "headword": "Abbildung",
    "translations": {
      "en": [
        "illustration",
        "figure"
      ],
      "fa": [
        "تصویر",
        "شکل"
      ]
    },
    "nounForms": {
      "article": "die",
      "plural": "-en"
    },
    "sentences": [
      {
        "german": "Auf der Abbildung sehen Sie, wie man das Gerät einschaltet.",
        "translations": {
          "en": "The illustration shows you how to switch on the device.",
          "fa": "در تصویر می‌بینید که چگونه دستگاه را روشن کنید."
        }
      }
    ],
    "level": "B1",
    "tags": []
  },
  {
    "id": "b1-noun-abenteuer",